{
  "min_score_to_queue": 55,
  "min_india_relevance": 55,
  "english_only": true,
  "translate_non_english": false,
  "database": "data/news.db",
  "queue_file": "data/queue.json",
  "telegram_queue_file": "data/telegram_queue.json",
  "source_health_file": "data/source_health.json",
  "event_memory_hours": 48,
  "major_event_memory_hours": 168,
  "story_memory_hours": 48,
  "breaking_min_score": 75,
  "discovery_min_score": 70,
  "max_stories_per_run": 5,
  "max_feed_entries_per_source": 25,
  "echo_similarity_threshold": 0.85,
  "article_extraction": {
    "enabled": true,
    "max_fetches_per_run": 15,
    "max_concurrent": 6,
    "connect_timeout_seconds": 10,
    "read_timeout_seconds": 20,
    "total_timeout_seconds": 30,
    "max_bytes": 2097152,
    "max_redirects": 3,
    "min_domain_interval_seconds": 1,
    "cache_ttl_hours_ok": 48,
    "cache_ttl_hours_error": 24,
    "max_article_sentences": 12,
    "max_briefing_sentences": 10,
    "min_useful_article_sentences": 2,
    "non_article_segments": [
      "video",
      "videos",
      "liveblog",
      "liveblogs",
      "newsfeed",
      "watch",
      "programmes"
    ],
    "paywall_markers": [
      "to continue reading",
      "subscribe to read",
      "subscriber-only",
      "subscribers only",
      "sign in to continue",
      "subscription required",
      "to read the full",
      "become a subscriber",
      "unlock this article",
      "already a subscriber",
      "for unlimited access"
    ]
  },
  "summarization": {
    "enabled": true,
    "min_sentences": 2,
    "max_sentences": 5,
    "tier1_max": 5
  },
  "telegram": {
    "channel_id": "",
    "telegram_state_file": "data/telegram_state.json",
    "telegram_queue_file": "data/telegram_queue.json",
    "freshness_hours": 6,
    "posted_retention_hours": 48,
    "max_candidates": 50,
    "max_posts_per_hour": 40,
    "max_posts_per_day": 150,
    "min_gap_seconds": 60,
    "normal_delay_seconds": [
      120,
      420
    ],
    "important_delay_seconds": [
      60,
      240
    ],
    "breaking_immediate": true,
    "just_in_freshness_minutes": 15,
    "target_message_chars": 1500,
    "max_message_chars": 3000,
    "max_attempts_per_story": 2,
    "media": {
      "enabled": true,
      "timeout_seconds": 12,
      "max_bytes": 10485760,
      "max_html_bytes": 2097152,
      "image_min_width": 300,
      "image_min_height": 200,
      "max_caption_chars": 1024
    }
  },
  "relevance": {
    "core_weight": 20,
    "institution_weight": 25,
    "figure_weight": 20,
    "company_weight": 25,
    "geo_weight": 12,
    "significance_weight": 25,
    "intl_weight": 15,
    "india_specific_intl_weight": 25,
    "subject_bonus": 35,
    "intl_bonus": 30,
    "significance_bonus": 20,
    "intl_anchor_bonus": 20,
    "title_multiplier": 1.0,
    "summary_multiplier": 0.6,
    "max_score": 100
  },
  "classification": {
    "title_multiplier": 1.0,
    "summary_multiplier": 0.6,
    "multiword_weight": 3.0,
    "single_word_weight": 2.0,
    "generic_single_word_weight": 0.6,
    "primary_min_score": 2.0,
    "secondary_min_score": 1.0,
    "max_score": 100.0,
    "international_damp": 0.6,
    "generic_single_words": [
      "government",
      "ministry",
      "cabinet",
      "parliament",
      "policy",
      "scheme",
      "bill",
      "mandate",
      "regulation",
      "notified",
      "vote",
      "poll",
      "speaker",
      "campaign",
      "bank",
      "bond",
      "company",
      "corporate",
      "industry",
      "trade",
      "board",
      "investment",
      "exercise",
      "intelligence",
      "chip",
      "space",
      "launch",
      "science",
      "research",
      "discovery",
      "warnings",
      "rescue",
      "disaster",
      "storm",
      "bench",
      "bar",
      "hearing",
      "stay",
      "health",
      "medal",
      "final",
      "record",
      "road",
      "flight",
      "ambassador",
      "power",
      "wind",
      "oil",
      "gas",
      "cop",
      "climate",
      "environment"
    ],
    "excluded_terms": [
      "who"
    ]
  },
  "dedupe": {
    "window_hours": 48,
    "major_window_hours": 168,
    "echo_title_threshold": 0.85,
    "echo_content_threshold": 0.8,
    "event_content_threshold": 0.5,
    "strong_content_threshold": 0.6,
    "max_candidates": 40,
    "min_token_len": 3,
    "stopwords": [
      "a",
      "an",
      "the",
      "and",
      "or",
      "but",
      "of",
      "to",
      "in",
      "on",
      "at",
      "for",
      "with",
      "by",
      "from",
      "as",
      "is",
      "are",
      "was",
      "were",
      "be",
      "been",
      "being",
      "has",
      "have",
      "had",
      "do",
      "does",
      "did",
      "will",
      "would",
      "can",
      "could",
      "may",
      "might",
      "should",
      "shall",
      "must",
      "this",
      "that",
      "these",
      "those",
      "it",
      "its",
      "he",
      "she",
      "they",
      "them",
      "his",
      "her",
      "their",
      "our",
      "we",
      "you",
      "your",
      "i",
      "me",
      "not",
      "no",
      "so",
      "if",
      "then",
      "than",
      "into",
      "over",
      "under",
      "between",
      "after",
      "before",
      "during",
      "up",
      "out",
      "about",
      "against",
      "per",
      "via",
      "all",
      "any",
      "more",
      "most",
      "some",
      "such",
      "only",
      "own",
      "same",
      "also",
      "now",
      "say",
      "says",
      "said",
      "told",
      "tell",
      "report",
      "reports",
      "reported",
      "according",
      "officials",
      "official",
      "india",
      "indian",
      "govt",
      "government",
      "centre",
      "central",
      "state",
      "states",
      "new",
      "news",
      "day",
      "days",
      "year",
      "years",
      "week",
      "weeks",
      "month",
      "months",
      "amid",
      "after",
      "says",
      "say"
    ],
    "wire_attributions": {
      "pti": [
        "pti",
        "press trust of india"
      ],
      "ani": [
        "ani",
        "asian news international"
      ],
      "reuters": [
        "reuters"
      ],
      "afp": [
        "afp",
        "agence france-presse"
      ],
      "ians": [
        "ians",
        "indo-asian news service"
      ]
    },
    "wire_source_groups": {
      "reuters-india": "reuters",
      "ap-india": "ap",
      "ft-india": "ft",
      "google-news-india": "google-news"
    },
    "event_actions": {
      "cuts": "cut",
      "slashes": "cut",
      "reduces": "cut",
      "lowers": "cut",
      "trims": "cut",
      "hikes": "hike",
      "raises": "hike",
      "increases": "hike",
      "keeps": "hold",
      "holds": "hold",
      "maintains": "hold",
      "announces": "announce",
      "announced": "announce",
      "launches": "launch",
      "launched": "launch",
      "unveils": "launch",
      "introduces": "launch",
      "flags off": "launch",
      "inaugurates": "launch",
      "approves": "approve",
      "approved": "approve",
      "clears": "approve",
      "cleared": "approve",
      "greenlights": "approve",
      "passes": "pass",
      "passed": "pass",
      "appoints": "appoint",
      "appointed": "appoint",
      "names": "appoint",
      "resigns": "resign",
      "quits": "resign",
      "steps down": "resign",
      "wins": "win",
      "winning": "win",
      "beats": "win",
      "defeats": "win",
      "strikes": "strike",
      "hits": "strike",
      "slams": "strike",
      "lashes": "strike",
      "batters": "strike",
      "raids": "raid",
      "raided": "raid",
      "busts": "raid",
      "arrests": "arrest",
      "arrested": "arrest",
      "detains": "arrest",
      "nabs": "arrest",
      "dies": "die",
      "dead": "die",
      "killed": "die",
      "kills": "die",
      "perishes": "die",
      "injured": "injure",
      "hurt": "injure",
      "warns": "warn",
      "warned": "warn"
    },
    "entity_aliases": {
      "central bank": "reserve bank of india",
      "the central bank": "reserve bank of india",
      "mpc": "reserve bank of india"
    },
    "international_entities": [
      "sudan",
      "russia",
      "china",
      "pakistan",
      "bangladesh",
      "nepal",
      "sri lanka",
      "myanmar",
      "afghanistan",
      "ukraine",
      "iran",
      "israel",
      "qatar",
      "saudi arabia",
      "united arab emirates",
      "japan",
      "france",
      "germany",
      "canada",
      "australia",
      "taiwan",
      "vietnam",
      "thailand",
      "malaysia",
      "singapore",
      "south korea",
      "indonesia",
      "egypt",
      "turkey",
      "united states",
      "united kingdom",
      "palestine",
      "lebanon",
      "syria",
      "yemen"
    ],
    "number_units": [
      "percent",
      "%",
      "per cent",
      "basis points",
      "bps",
      "billion",
      "bn",
      "million",
      "mn",
      "lakh",
      "crore",
      "cr",
      "km",
      "kmph",
      "km/h",
      "kg",
      "tonnes",
      "tons",
      "deaths",
      "dead",
      "killed",
      "injured",
      "people",
      "persons",
      "crimes",
      "crs",
      "feet"
    ]
  },
  "editorial": {
    "base_score": 70,
    "pass_threshold": 60,
    "filler_threshold": 35,
    "title_multiplier": 1.5,
    "summary_multiplier": 0.5,
    "major_boost": 30,
    "importance_major_min": 1.1,
    "importance_strong_min": 1.2,
    "major_markers": [
      "breaking",
      "confirmed"
    ],
    "weak_term_weights": {
      "reportedly": 6
    },
    "gates": {
      "clickbait": {
        "weight": 25,
        "override": "any"
      },
      "gossip": {
        "weight": 35,
        "override": "any"
      },
      "celebrity": {
        "weight": 15,
        "override": "any"
      },
      "astrology": {